{
  "v": 1,
  "week_id": "2025-W52",
  "generated_at": "2025-12-22T00:00:00+09:00",
  "items": [
    {
      "rank": 1,
      "action_id": "A-WAIT-001",
      "title": "Retry operation later (Transient)",
      "score": 35,
      "playbook_ref": "docs/playbooks/transient.md",
      "signals": {
        "count_now": 1,
        "delta": 1,
        "hint_key": "retry_later"
      }
    }
  ]
}
